{
  "settingId": "spuk_im_gewoelbe",
  "hinweis": "Besetzungsreihenfolge. Gezählt werden Rollen ohne das Geburtstagskind, das den Detektiv spielt. Bei N Rollen werden die Plätze 1 bis N besetzt; alle übrigen Gäste sind NPC-Gäste ohne Spieler. Ihr Wissen erreicht den Detektiv über den Erzähler oder die Sprechblasen der Bots.",
  "minRollen": 4,
  "maxRollen": 20,
  "reihenfolge": [
    "adnan",
    "rojda",
    "merle",
    "jonas",
    "paulina",
    "diyar",
    "emre",
    "lejla",
    "tomasz",
    "annika",
    "berfin",
    "dino",
    "selin",
    "kamil",
    "derya",
    "amar",
    "henrik",
    "elif",
    "azad",
    "zofia"
  ],
  "stufen": [
    {
      "stufe": 1,
      "plaetze": [
        1,
        4
      ]
    },
    {
      "stufe": 2,
      "plaetze": [
        5,
        8
      ]
    },
    {
      "stufe": 3,
      "plaetze": [
        9,
        12
      ]
    },
    {
      "stufe": 4,
      "plaetze": [
        13,
        16
      ]
    },
    {
      "stufe": 5,
      "plaetze": [
        17,
        20
      ]
    }
  ],
  "geschlechterBilanz": [
    {
      "rollen": 4,
      "m": 2,
      "w": 2
    },
    {
      "rollen": 5,
      "m": 2,
      "w": 3
    },
    {
      "rollen": 6,
      "m": 3,
      "w": 3
    },
    {
      "rollen": 7,
      "m": 4,
      "w": 3
    },
    {
      "rollen": 8,
      "m": 4,
      "w": 4
    },
    {
      "rollen": 9,
      "m": 5,
      "w": 4
    },
    {
      "rollen": 10,
      "m": 5,
      "w": 5
    },
    {
      "rollen": 11,
      "m": 5,
      "w": 6
    },
    {
      "rollen": 12,
      "m": 6,
      "w": 6
    },
    {
      "rollen": 13,
      "m": 6,
      "w": 7
    },
    {
      "rollen": 14,
      "m": 7,
      "w": 7
    },
    {
      "rollen": 15,
      "m": 7,
      "w": 8
    },
    {
      "rollen": 16,
      "m": 8,
      "w": 8
    },
    {
      "rollen": 17,
      "m": 9,
      "w": 8
    },
    {
      "rollen": 18,
      "m": 9,
      "w": 9
    },
    {
      "rollen": 19,
      "m": 10,
      "w": 9
    },
    {
      "rollen": 20,
      "m": 10,
      "w": 10
    }
  ],
  "regeln": [
    "Die vier Kernverdächtigen sind immer besetzt (Plätze 1–4).",
    "Ab 5 Rollen unterscheiden sich Frauen- und Männerrollen höchstens um eine; bei 4 Rollen geben die Kernnamen 2 zu 2 vor.",
    "Jede Rolle darf von jeder Person gespielt werden, unabhängig vom eigenen Geschlecht.",
    "Fehlt ein Gesprächspartner, übernimmt der erste besetzte Ersatzpartner aus ersatzpartner, sonst die besetzte Person mit der kleinsten Last. Kernrollen sind immer besetzt und brauchen keinen Ersatz.",
    "Unbesetzte Gäste sind NPC. Ihre Beobachtungen für den Tisch kommen als Ansage des Erzählers; verborgenes Wissen bleibt in ihrer Karte."
  ],
  "ersatzpartner": {
    "paulina": [
      "jonas",
      "adnan"
    ],
    "diyar": [
      "merle",
      "rojda",
      "jonas",
      "adnan"
    ],
    "emre": [
      "rojda",
      "merle"
    ],
    "lejla": [
      "adnan",
      "paulina",
      "rojda",
      "jonas"
    ],
    "tomasz": [
      "rojda",
      "jonas"
    ],
    "annika": [
      "emre",
      "adnan"
    ],
    "berfin": [
      "merle",
      "adnan"
    ],
    "dino": [
      "tomasz",
      "rojda"
    ],
    "selin": [
      "jonas",
      "merle"
    ],
    "kamil": [
      "berfin",
      "adnan"
    ],
    "derya": [
      "rojda",
      "jonas"
    ],
    "amar": [
      "selin",
      "merle"
    ],
    "henrik": [
      "adnan",
      "rojda"
    ],
    "elif": [
      "derya",
      "jonas"
    ],
    "azad": [
      "merle",
      "adnan"
    ],
    "zofia": [
      "henrik",
      "rojda"
    ]
  },
  "generiert": "akte_export"
}
